{
  "$schema": "https://json-schema.org/draft/2020-12/schema",
  "$id": "https://github.com/nigelng/dotnix-starter/config/schema/host.schema.json",
  "title": "nix-darwin host config",
  "type": "object",
  "additionalProperties": false,
  "required": [
    "description",
    "adminUsername",
    "machineType",
    "computerName",
    "hostName",
    "screenshotFolder",
    "homebrewPrefix",
    "homebrewCleanup",
    "trustedUsers",
    "allowedUsers"
  ],
  "properties": {
    "description": { "type": "string", "minLength": 1 },
    "adminUsername": { "type": "string", "minLength": 1 },
    "machineType": { "type": "string", "enum": ["laptop", "macmini"] },
    "computerName": { "type": "string", "minLength": 1 },
    "hostName": { "type": "string", "minLength": 1 },
    "screenshotFolder": { "type": "string", "minLength": 1 },
    "homebrewPrefix": { "type": "string", "minLength": 1 },
    "homebrewCleanup": {
      "type": "string",
      "enum": ["none", "check", "uninstall", "zap"],
      "description": "Prefer check on shared machines; zap is destructive (removes undeclared formulae/casks)."
    },
    "trustedUsers": {
      "type": "array",
      "items": { "type": "string" },
      "description": "Extra Nix trusted-users beyond adminUsername. Never use \"*\" — trusted users can add substituters without a password prompt."
    },
    "allowedUsers": {
      "type": "array",
      "items": { "type": "string" },
      "minItems": 1,
      "description": "Nix allowed-users. Prefer explicit usernames; never use \"*\"."
    },
    "extraSessionPaths": {
      "type": "array",
      "items": { "type": "string" }
    },
    "knownNetworkServices": {
      "type": "array",
      "items": { "type": "string", "minLength": 1 },
      "minItems": 1
    },
    "restartAfterPowerFailure": {
      "type": "boolean",
      "description": "Override the machineType preset (laptop=false, macmini=true)."
    },
    "automaticallyInstallMacOSUpdates": {
      "type": "boolean",
      "description": "Defaults to true. Set false before major macOS betas until nix-darwin supports the new OS."
    },
    "claudeKit": {
      "type": "boolean",
      "description": "Defaults to false. Enables the Claude/Cursor MCP + skills kit (overlay-provided module); starter itself ships no kit behavior."
    }
  }
}
