{
  "description": "Example Mac configuration",
  "machineType": "laptop",
  "computerName": "example-mac",
  "hostName": "example-mac",
  "adminUsername": "youruser",
  "screenshotFolder": "~/Desktop/Screenshots",
  "homebrewPrefix": "/opt/homebrew",
  "homebrewCleanup": "check",
  "trustedUsers": [],
  "allowedUsers": ["youruser"],
  "claudeKit": false
}
